{
  "workItem": "issue107-provider-bounded-transport-faults",
  "sourceRevision": "bd8818625aa51480e3a06c1fa17d3e223fa1cfbe",
  "boundary": "Isolated exact historical bounded-transport snapshot; final provider metadata-only delta, NUL validation and test formatting are independently reviewed and freshly verified separately. Actual model calls0.",
  "sourceFiles": [
    {
      "path": "src/main/kotlin/com/meetme/server/precheck/adapter/output/provider/GeminiPreSubmissionCheckProvider.kt",
      "sha256": "7aff0a972bd9e6ed00609ccf6fe79cb478b91fc344950a760d228148dda6e860"
    },
    {
      "path": "src/main/kotlin/com/meetme/server/precheck/adapter/output/provider/PrecheckProviderContract.kt",
      "sha256": "4eac4cdf703831b0bfc074856c29ed4c07f762d971ecdc79051f15e21a72f1a0"
    }
  ],
  "testFiles": [
    {
      "path": "src/test/kotlin/com/meetme/server/precheck/adapter/output/provider/PrecheckProviderTransportContractTest.kt",
      "sha256": "7227847aeae9d6f03b34acab4dd27ebc64f94eb76e96f5a6d91a6fff05275ba8"
    },
    {
      "path": "src/test/kotlin/com/meetme/server/precheck/adapter/output/provider/PrecheckProviderRetryAfterContractTest.kt",
      "sha256": "35fa215b897b5a0105b45e3d31a9a66ee20e1fd8d230fbc80a679f54b9406728"
    }
  ],
  "injections": [
    {
      "fault": "unverified-cap-call",
      "command": [
        "flock",
        "/tmp/meetme-gradle.lock",
        "/tmp/meetme-provider-faults/gradlew",
        "-p",
        "/tmp/meetme-provider-faults",
        "-I",
        "/tmp/meetme-provider-only.init.gradle",
        "test",
        "--tests",
        "*PrecheckProvider*ContractTest",
        "--max-workers=2"
      ],
      "detectedBy": "P12 unavailable bounded configuration fails before network()",
      "result": "DETECTED"
    },
    {
      "fault": "oversize-body",
      "command": [
        "flock",
        "/tmp/meetme-gradle.lock",
        "/tmp/meetme-provider-faults/gradlew",
        "-p",
        "/tmp/meetme-provider-faults",
        "-I",
        "/tmp/meetme-provider-only.init.gradle",
        "test",
        "--tests",
        "*PrecheckProvider*ContractTest",
        "--max-workers=2"
      ],
      "detectedBy": "P08 oversized actual HTTP body is rejected without retry(); P13 invalid raw input and oversized request are not sent or truncated()",
      "result": "DETECTED"
    },
    {
      "fault": "stalled-body-no-call-deadline",
      "command": [
        "flock",
        "/tmp/meetme-gradle.lock",
        "/tmp/meetme-provider-faults/gradlew",
        "-p",
        "/tmp/meetme-provider-faults",
        "-I",
        "/tmp/meetme-provider-only.init.gradle",
        "test",
        "--tests",
        "*PrecheckProvider*ContractTest",
        "--max-workers=2"
      ],
      "detectedBy": "P11 timeout includes stalled response body and terminates the exchange()",
      "result": "DETECTED"
    },
    {
      "fault": "hidden-retry-after",
      "command": [
        "flock",
        "/tmp/meetme-gradle.lock",
        "/tmp/meetme-provider-faults/gradlew",
        "-p",
        "/tmp/meetme-provider-faults",
        "-I",
        "/tmp/meetme-provider-only.init.gradle",
        "test",
        "--tests",
        "*PrecheckProvider*ContractTest",
        "--max-workers=2"
      ],
      "detectedBy": "P09 server error sends one physical request without hidden retry(); P16 server Retry After zero cannot authorize a second physical exchange()",
      "result": "DETECTED"
    },
    {
      "fault": "unknown-json-field",
      "command": [
        "flock",
        "/tmp/meetme-gradle.lock",
        "/tmp/meetme-provider-faults/gradlew",
        "-p",
        "/tmp/meetme-provider-faults",
        "-I",
        "/tmp/meetme-provider-only.init.gradle",
        "test",
        "--tests",
        "*PrecheckProvider*ContractTest",
        "--max-workers=2"
      ],
      "detectedBy": "P04 missing verdict unknown key invalid enum and malformed JSON are typed failures()",
      "result": "DETECTED"
    }
  ],
  "recordedAt": "2026-10-17T18:35:57.454342Z"
}
