{
  "workItem": "issue-91-time-context",
  "sourceRevision": "848b9688451551781769799ff7d27485ea5a5445",
  "boundary": "Immutable room-local reference dates, whole-input context inheritance, provider contract validation and fail-closed attendance",
  "sourceFiles": [
    {
      "path": "src/main/kotlin/com/meetme/server/coordination/adapter/output/integration/KoreanTimeContextResolver.kt",
      "sha256": "fdc91b0bedc42ab530ba283c99f75eaf93f92ee7bd8163c5a1759d3b659425ea"
    },
    {
      "path": "src/main/kotlin/com/meetme/server/coordination/adapter/output/integration/GeminiNaturalLanguageParserAdapter.kt",
      "sha256": "3a00c239e17c37c28c2b7fda7df9d8b7f3851a5e14a6717dea2b681df85feecb"
    },
    {
      "path": "src/main/kotlin/com/meetme/server/coordination/application/service/GeminiBatchProcessor.kt",
      "sha256": "8eef4cf574d5ed98ede6e8392bba08821004de52469557773350f4db7a58367a"
    }
  ],
  "testFiles": [
    {
      "path": "src/test/kotlin/com/meetme/server/coordination/adapter/output/integration/GeminiTimeContextBoundaryReviewTest.kt",
      "sha256": "80d25173ef3eea3ef616fa36aca4183f121764446057eb77461da29b6f80810b"
    },
    {
      "path": "src/test/kotlin/com/meetme/server/coordination/adapter/output/integration/GeminiTimeContextContractTest.kt",
      "sha256": "e9233f212d49e7bf54577cb5315010c087567fbf449ccd51106af5842c0f18a5"
    },
    {
      "path": "src/test/kotlin/com/meetme/server/coordination/adapter/output/integration/GeminiTimeContextNightBoundaryTest.kt",
      "sha256": "0672dda271ebaf1c6f8430fd947e96a94a76c18da2f4edbbb4eabff021f92c7c"
    },
    {
      "path": "src/test/kotlin/com/meetme/server/coordination/adapter/output/integration/GeminiTimeContextProviderSafetyTest.kt",
      "sha256": "5c0a1d2eae6e11834e484bc6ac04783e945771920d7d54a8cbeb4177443219d6"
    },
    {
      "path": "src/test/kotlin/com/meetme/server/coordination/adapter/output/integration/GeminiTimeContextSafetyReviewTest.kt",
      "sha256": "6254b2a90c24318e995b94888a903ef3300048658d54f28abaf375555450260e"
    },
    {
      "path": "src/test/kotlin/com/meetme/server/coordination/application/service/GeminiTimeReferenceDateTest.kt",
      "sha256": "8b6bc954ae9ee846dc7df89b222635598d1b11341d91cecc20670094c2ecc3f5"
    }
  ],
  "injections": [
    {
      "fault": "Remove the hard Thursday exclusion by marking it AVAILABLE",
      "command": [
        "./gradlew",
        "--no-daemon",
        "test",
        "--tests",
        "*GeminiTimeContextContractTest"
      ],
      "detectedBy": "com.meetme.server.coordination.adapter.output.integration.GeminiTimeContextContractTest#explicit morning afternoon and 24 hour provider interpretation is not shifted(); com.meetme.server.coordination.adapter.output.integration.GeminiTimeContextContractTest#reference week starts Monday across Sunday Monday month and year boundaries(); com.meetme.server.coordination.adapter.output.integration.GeminiTimeContextContractTest#weekday exception inherits parent end and subtracts the earlier Thursday hour(); com.meetme.server.coordination.adapter.output.integration.GeminiTimeContextContractTest#this week exception does not narrow next weeks Thursday(); com.meetme.server.coordination.adapter.output.integration.GeminiTimeContextContractTest#real two participant matcher produces the exact five intervals()",
      "result": "DETECTED"
    },
    {
      "fault": "Leak a this-week date exception into every recurring Thursday",
      "command": [
        "./gradlew",
        "--no-daemon",
        "test",
        "--tests",
        "*GeminiTimeContextContractTest"
      ],
      "detectedBy": "com.meetme.server.coordination.adapter.output.integration.GeminiTimeContextContractTest#reference week starts Monday across Sunday Monday month and year boundaries(); com.meetme.server.coordination.adapter.output.integration.GeminiTimeContextContractTest#thirty one day search does not force recurring conditions past the thirty two limit(); com.meetme.server.coordination.adapter.output.integration.GeminiTimeContextContractTest#this week exception does not narrow next weeks Thursday()",
      "result": "DETECTED"
    },
    {
      "fault": "Use the worker clock instead of immutable submission creation date",
      "command": [
        "./gradlew",
        "--no-daemon",
        "test",
        "--tests",
        "*GeminiTimeReferenceDateTest"
      ],
      "detectedBy": "com.meetme.server.coordination.application.service.GeminiTimeReferenceDateTest#technical retries keep frozen reference dates despite worker time a week later(); com.meetme.server.coordination.application.service.GeminiTimeReferenceDateTest#adapter context flows through the real batch and matching processors to a complete two person result(); com.meetme.server.coordination.application.service.GeminiTimeReferenceDateTest#immutable submission creation instant becomes each rooms local reference date at KST midnight(); com.meetme.server.coordination.application.service.GeminiTimeReferenceDateTest#new submission version uses its new creation date while older version stays immutable()",
      "result": "DETECTED"
    },
    {
      "fault": "Accept provider success after unsafe source context is rejected",
      "command": [
        "./gradlew",
        "--no-daemon",
        "test",
        "--tests",
        "*GeminiTimeContextProviderSafetyTest"
      ],
      "detectedBy": "com.meetme.server.coordination.adapter.output.integration.GeminiTimeContextProviderSafetyTest#provider success cannot admit afternoon child outside an explicit morning parent(); com.meetme.server.coordination.adapter.output.integration.GeminiTimeContextProviderSafetyTest#provider success cannot admit a child that starts outside its compatible parent(); com.meetme.server.coordination.adapter.output.integration.GeminiTimeContextProviderSafetyTest#provider success cannot silently ignore an unknown conditional or injection tail(); com.meetme.server.coordination.adapter.output.integration.GeminiTimeContextProviderSafetyTest#provider success cannot erase negative or double negative residual clauses(); com.meetme.server.coordination.adapter.output.integration.GeminiTimeContextProviderSafetyTest#provider success cannot invent an end for an orphan start-only context(); com.meetme.server.coordination.adapter.output.integration.GeminiTimeContextProviderSafetyTest#provider success cannot choose one of conflicting parent ends(); com.meetme.server.coordination.adapter.output.integration.GeminiTimeContextProviderSafetyTest#provider success cannot flatten context coupled to a conditional place()",
      "result": "DETECTED"
    },
    {
      "fault": "Discard the explicit morning period inherited by an omitted end",
      "command": [
        "./gradlew",
        "--no-daemon",
        "test",
        "--tests",
        "*GeminiTimeContextSafetyReviewTest"
      ],
      "detectedBy": "com.meetme.server.coordination.adapter.output.integration.GeminiTimeContextSafetyReviewTest#explicit morning start supplies the unstated end period before child inheritance()",
      "result": "DETECTED"
    },
    {
      "fault": "Hide a provider-wide place-name conflict after removing rejected input conditions",
      "command": [
        "./gradlew",
        "--no-daemon",
        "test",
        "--tests",
        "*GeminiTimeContextBoundaryReviewTest"
      ],
      "detectedBy": "com.meetme.server.coordination.adapter.output.integration.GeminiTimeContextBoundaryReviewTest#provider area name conflicts remain invalid before unsafe input conditions are discarded()",
      "result": "DETECTED"
    }
  ],
  "recordedAt": "2026-10-07T01:10:48Z"
}
