{
  "workItem": "issue131-managed-runtime-savepoint-independent-fault",
  "sourceRevision": "3982535765e878875a901dd9d28352358e594f6f",
  "boundary": "Actual INSERT authority invalidation after physical-transaction savepoint rollback; pre-savepoint outer INSERT authority remains usable",
  "sourceFiles": [
    {
      "path": "src/main/kotlin/com/meetme/server/shared/adapter/output/persistence/NewRoomInsertTransactionReceipts.kt",
      "sha256": "213986579bf0d197a3241c883e6e08037a39cf7c34a68463c8ab872c967f034f"
    }
  ],
  "testFiles": [
    {
      "path": "src/test/kotlin/com/meetme/server/coordination/adapter/input/web/Issue131ManagedRuntimeSavepointPostgresTest.kt",
      "sha256": "d98c79251df3e4b3f0b0ff26861e219d1996d8e7693efbd14d6c2d91ec6b3be0"
    }
  ],
  "injections": [
    {
      "fault": "Omit savepoint rollback invalidation of post-savepoint INSERT authority",
      "command": [
        "./gradlew",
        "--offline",
        "--no-daemon",
        "--max-workers=2",
        "test",
        "--tests",
        "*Issue131ManagedRuntimeSavepointPostgresTest"
      ],
      "detectedBy": "com.meetme.server.coordination.adapter.input.web.Issue131ManagedRuntimeSavepointPostgresTest.RB03 INSERT rolled back to savepoint cannot authorize raw same-ID insertion later in that transaction()",
      "result": "DETECTED"
    }
  ],
  "recordedAt": "2026-10-18T11:12:46.890200Z"
}
