{
  "$schema": "../schema/fault-injection-evidence.schema.json",
  "workItem": "issue-50-gemini-typed-output-schema",
  "sourceRevision": "597f5aa5ad46ffc89d5995225f669fa950f28830",
  "boundary": "Gemini type-specific required fields and room-local time output contract",
  "sourceFiles": [
    {
      "path": "src/main/kotlin/com/meetme/server/coordination/adapter/output/integration/GeminiNaturalLanguageParserAdapter.kt",
      "sha256": "169711af61f5919aa92534486c5c499471269286027c93a55ef2fb128d2bc0eb"
    }
  ],
  "testFiles": [
    {
      "path": "src/test/kotlin/com/meetme/server/coordination/adapter/output/integration/GeminiNaturalLanguageParserAdapterTest.kt",
      "sha256": "0cd9fcb291f8ced833846cec99305747caa33d37b1dbfea3d538d6a37090369f"
    }
  ],
  "injections": [
    {
      "fault": "Removed end_time from the required TIME_WINDOW fields",
      "command": [
        ".\\gradlew.bat",
        "--no-daemon",
        "test",
        "--tests",
        "*GeminiNaturalLanguageParserAdapterTest.타입별 필수 조건과 offset 없는 지역 시각 schema를 제공한다"
      ],
      "detectedBy": "The provider schema contract test detected that an incomplete TIME_WINDOW could be generated",
      "result": "DETECTED"
    },
    {
      "fault": "Restored RFC 3339 format time on room-local start_time and end_time fields",
      "command": [
        ".\\gradlew.bat",
        "--no-daemon",
        "test",
        "--tests",
        "*GeminiNaturalLanguageParserAdapterTest.타입별 필수 조건과 offset 없는 지역 시각 schema를 제공한다"
      ],
      "detectedBy": "The provider schema contract test detected that UTC-offset output was allowed again",
      "result": "DETECTED"
    }
  ],
  "recordedAt": "2026-09-20T11:53:49.2874053Z"
}
